fieldID,,fieldName,fieldType,defaultValue,secondaryValue,,,fieldDescription,,,minValue,maxValue,tab
aitweaks_enable_fleet_cohesion_ai,,Enable Fleet Cohesion AI,Boolean,true,,,,"Should the AI attempt to maintain fleet cohesion by auto-assigning move commands to cruisers and capitals that stray off from the rest of the fleet.",,
aitweaks_enable_staggered_fire,,Enable Staggered Firing Mode,Boolean,true,,,,"Ships will use autofire weapons in staggered firing mode. In this mode, all weapons of the same type fire at a constant interval. Currently, this feature is available only for ships with Custom AI.",,
aitweaks_enable_needler_fix,,Eanble Anti Shield Burst Weapon AI,Boolean,true,,,,"Adjusts all ammo-based kinetic weapons, as well as the vanilla Light and Medium Needlers, to attack enemy ships only when their shields are raised. This optimizes flux usage and burst effectiveness for breaking through shields.",,
aitweaks_enable_title_screen_fire,,Enable Title Screen Fire,Boolean,true,,,,Ships on the title screen fire at asteroids.,,
aitweaks_enable_simulator_custom_ai,,Enable Custom AI in Simulator,Boolean,true,,,,"Eligible enemy ships in the simulator are controlled by AI Tweaks custom AI.",,
aitweaks_ai_core_personality,,Player Fleet AI Core Personality,Radio,Aggressive,"Timid, Cautious, Steady, Aggressive, Reckless, Vanilla",,,"Override the personality of automated ships in the player fleet. In vanilla, automated ships (except carriers) are locked to fearless personality. Ships with AI personality overridden by a mod other than AI Tweaks will remain unaffected.",,
aitweaks_shield_assist_keybind,,Shield Assist Toggle Keybind,Keycode,27,,,,Hotkey used to pass control of player ship shield to AI. The AI will take over the shield control when player is piloting manually. Indicator circle is drawn around the ship when shield is in AI control.,,,,,Player Assist
aitweaks_aim_bot_keybind,,Aim Assist Toggle Keybind,Keycode,26,,,,"Hotkey to toggle aim assist for manually controlled weapon groups. When enabled, aim assist automatically calculates and applies target leading for all projectile and unguided missile weapons in the selected weapon group.",,,,,Player Assist
aitweaks_aim_bot_rotate_ship,,Aim Assist Controls Ship Facing,Boolean,true,,,,"Allow aim assist to correct ship facing when auto-turning to cursor. Aim assist will rotate the ship to correctly aim the selected weapon group.",,,,,Player Assist
aitweaks_aim_bot_target_junk,,Aim Assist Targets Hulks And Asteroids,Boolean,false,,,,Allow aim assist to target hulks and asteroids when no enemy ships are nearby. This setting is primarily used for testing and development.,,,,,Player Assist
aitweaks_enable_devmode,,Dev Mode,Boolean,false,,,,"Enable AI Tweaks dev mode.",,,,,Debug
aitweaks_highlight_custom_ai,,Highlight Custom AI,Boolean,false,,,,"Highlight ships piloted by AI Tweaks custom AI. Works only in devmode.",,,,,Debug
aitweaks_remove_combat_map_grid,,Remove Combat Map Grid,Boolean,false,,,,"Remove the square grid in combat map.",,,,,Debug